[
    {
        "version": "1441716120:318744030", 
        "hostname": "host1", 
        "label": "host1", 
        "href": "http://172.29.176.102:12345/", 
        "services": [
            {
                "href": "http://172.29.176.102:12345/x-manufacturer/status/", 
                "type": "urn:x-manufacturer:service:status"
            }, 
            {
                "href": "http://172.29.176.102:12345/x-manufacturer/pipelinemanager/", 
                "type": "urn:x-manufacturer:service:pipelinemanager"
            }, 
            {
                "href": "http://172.29.176.102:12345/x-manufacturer/mdnsbridge/", 
                "type": "urn:x-manufacturer:service:mdnsbridge"
            }
        ], 
        "caps": {}, 
        "id": "c8ba20e9-e197-4ec5-8764-4da672128589"
    }, 
    {
        "version": "1441716067:450064243", 
        "hostname": "host2", 
        "label": "host2", 
        "href": "http://172.29.176.19:12345/", 
        "services": [
            {
                "href": "http://172.29.176.19:12345/x-manufacturer/pipelinemanager/", 
                "type": "urn:x-manufacturer:service:pipelinemanager"
            }, 
            {
                "href": "http://172.29.176.19:12345/x-manufacturer/status/", 
                "type": "urn:x-manufacturer:service:status"
            }, 
            {
                "href": "http://172.29.176.19:12345/x-manufacturer/mdnsbridge/", 
                "type": "urn:x-manufacturer:service:mdnsbridge"
            }
        ], 
        "caps": {}, 
        "id": "cebc6305-e8db-4026-aeb5-eb7a5620839e"
    }
]
