{
    "version": "1441700172:318426300", 
    "hostname": "host1", 
    "caps": {}, 
    "href": "http://172.29.80.65:12345/", 
    "services": [
        {
            "href": "http://172.29.80.65:12345/x-manufacturer/pipelinemanager/", 
            "type": "urn:x-manufacturer:service:pipelinemanager"
        }, 
        {
            "href": "http://172.29.80.65:12345/x-manufacturer/status/", 
            "type": "urn:x-manufacturer:service:status"
        }, 
        {
            "href": "http://172.29.80.65:12345/x-manufacturer/tally/", 
            "type": "urn:x-manufacturer:service:tally"
        }, 
        {
            "href": "http://172.29.80.65:12345/x-manufacturer/mdnsbridge/", 
            "type": "urn:x-manufacturer:service:mdnsbridge"
        }, 
        {
            "href": "http://172.29.80.65:12345/x-manufacturer/storequery/", 
            "type": "urn:x-manufacturer:service:storequery"
        }
    ], 
    "label": "host1", 
    "id": "3b8be755-08ff-452b-b217-c9151eb21193"
}
